[
  {
    "schemaVersion": "1.0.0",
    "id": "eq.barbell",
    "canonical": { "name": "Barbell", "slug": "barbell", "abbreviation": "BB" },
    "classification": { "tags": ["free-weight"] },
    "metadata": { "createdAt": "2025-01-01T00:00:00Z", "updatedAt": "2025-09-03T00:00:00Z", "status": "active" }
  },
  {
    "schemaVersion": "1.0.0",
    "id": "eq.dumbbell",
    "canonical": { "name": "Dumbbell", "slug": "dumbbell" },
    "classification": { "tags": ["free-weight"] },
    "metadata": { "createdAt": "2025-01-01T00:00:00Z", "updatedAt": "2025-09-03T00:00:00Z", "status": "active" }
  },
  {
    "schemaVersion": "1.0.0",
    "id": "eq.latPulldown",
    "canonical": { "name": "Lat Pulldown Machine", "slug": "lat-pulldown-machine" },
    "classification": { "tags": ["machine"] },
    "metadata": { "createdAt": "2025-01-01T00:00:00Z", "updatedAt": "2025-09-03T00:00:00Z", "status": "active" }
  }
]

